{
  "claims": [],
  "detector_notes": [],
  "metadata": {
    "created_at": "2026-07-09T15:52:51+00:00",
    "required_ai_text_risk_skill": "ai-text-risk-gate",
    "required_ai_text_risk_skill_ref": ".agents/skills/ai-text-risk-gate/SKILL.md",
    "required_skill": "content-seo-authenticity",
    "required_skill_ref": ".agents/skills/content-seo-authenticity/SKILL.md",
    "status": "draft",
    "target": "brands/inc5/blogs/drafts/7-heel-mistakes-that-make-outfits-hurt-or-look-off.md"
  },
  "sources": [
    {
      "extracted_facts": "Inc5 is an Indian fashion footwear and bags brand with ecommerce and offline retail presence. The brand context supports practical, category-led advice around women's footwear, comfort, craftsmanship, contemporary design, care, returns, exchanges, and store discovery.",
      "source_id": "inc5-brand-dna",
      "source_ref": "brands/inc5/brand-dna.md",
      "source_type": "brand_dna"
    },
    {
      "extracted_facts": "Primary keyword 'heels for women' is high priority for India, has Google Keyword Planner volume 201000, current average GSC position 6.58, 508 recent clicks, 152181 recent impressions, and ranking page https://inc5shop.com/collections/womens-heels. Related high-priority terms include block heels for women, platform heels for women, comfortable heels for women, transparent heels, high heels for women, and heel sandals for women.",
      "source_id": "inc5-keyword-heels-for-women",
      "source_ref": "brands/inc5/exports/prioritized-keyword-current-rankings.csv",
      "source_type": "gsc"
    },
    {
      "extracted_facts": "Inc5 navigation and blog crawl evidence includes collection paths for women's heels, transparent heels, sandals, mules, flats, ethnic footwear, boots, wedges, platform heels, pumps, comfort footwear, and all women's footwear. These paths support internal links used in the draft.",
      "source_id": "inc5-collection-paths",
      "source_ref": "brands/inc5/references/brand-dna-firecrawl-20260709T133500Z/blog.json",
      "source_type": "product_page"
    },
    {
      "extracted_facts": "YouTube search evidence for heel mistakes and heel hacks indicates audience interest in practical mistake-led advice around heels, outfit styling, and comfort. Used only as topic-angle evidence, not as product, ranking, comfort, or medical proof.",
      "source_id": "youtube-heel-mistake-angle",
      "source_ref": "https://www.youtube.com/watch?v=MZid8vGu9FQ",
      "source_type": "youtube_video"
    },
    {
      "extracted_facts": "Live Inc5 wedges collection describes peep-toe wedges, block heel wedges, and embellished wedges. It positions block heel wedges as wider and more stable than traditional stiletto heels, and notes embellished wedges for weddings and festive outfits such as sarees, lehengas, and indo-western looks.",
      "source_id": "inc5-live-wedges-collection-20260709",
      "source_ref": "https://inc5shop.com/collections/womens-wedges",
      "source_type": "product_page"
    },
    {
      "extracted_facts": "Live Inc5 heels collection lists women heel styles including block heels, kitten heels, platform heels, pumps, stiletto heels, wedge heels, sandals, mules, and related sizes. The page says comfort depends on fit, toe box, heel height, stable base, padding, occasion, and outfit length.",
      "source_id": "inc5-live-heels-collection-20260709",
      "source_ref": "https://inc5shop.com/collections/womens-heels",
      "source_type": "product_page"
    },
    {
      "extracted_facts": "Live Inc5 about page says the brand was established in 1998, began at Mumbai's Heera Panna, is present across 50+ cities, 20+ states, and 90+ stores, and blends comfort, craftsmanship, and contemporary design.",
      "source_id": "inc5-live-about-20260709",
      "source_ref": "https://inc5shop.com/pages/about-us",
      "source_type": "brand_dna"
    }
  ]
}
