{
  "metadata": {
    "created_at": "2026-07-09T00:00:00+00:00",
    "target": "brands/strique/blogs/drafts/content-automation-platform-briefs-to-campaigns.md",
    "status": "draft",
    "required_skill": "content-seo-authenticity",
    "required_skill_ref": ".agents/skills/content-seo-authenticity/SKILL.md",
    "required_ai_text_risk_skill": "ai-text-risk-gate",
    "required_ai_text_risk_skill_ref": ".agents/skills/ai-text-risk-gate/SKILL.md"
  },
  "sources": [
    {
      "source_id": "brand_dna",
      "source_type": "brand_dna",
      "source_ref": "brands/strique/brand-dna.md",
      "extracted_facts": "Strique is an agentic AI marketing platform and AI marketing OS for growth teams. The product covers paid media, SEO, content, lifecycle, reporting, research, generative content, scheduled automations, approval gates, closed-loop measurement, reusable skills, persistent memory, and Canvas reports. Brand voice is direct, confident, operator-centric, and plain-spoken."
    },
    {
      "source_id": "keywords",
      "source_type": "gsc",
      "source_ref": "brands/strique/keywords/keywords.csv",
      "extracted_facts": "The keyword file maps content automation platform, content automation platforms, content marketing automation, content marketing automation platform, content marketing automation tools, and content automation to commercial product intent for Strique."
    },
    {
      "source_id": "keyword_summary",
      "source_type": "gsc",
      "source_ref": "brands/strique/references/keyword-research-summary.json",
      "extracted_facts": "The keyword research summary was generated on 2026-06-29 for https://www.strique.io, target country United States, with 228 deduped universe rows, 150 prioritized rows, 226 Keyword Planner rows, and 0 GSC query rows in that summary artifact."
    },
    {
      "source_id": "url_inventory",
      "source_type": "product_page",
      "source_ref": "brands/strique/exports/url-inventory.csv",
      "extracted_facts": "The URL inventory includes the product page, content engine in a week playbook, SEO automation blog draft path, brand context extraction blog, closing the loop blog, integrations page, and customer stories as relevant internal link targets."
    },
    {
      "source_id": "site_checks",
      "source_type": "product_page",
      "source_ref": "brands/strique/exports/site-checks.csv",
      "extracted_facts": "Site checks show public crawl evidence, rendered browser evidence, performance evidence, keyword demand evidence, and GSC measurement coverage are available. PostHog evidence is blocked in this artifact."
    },
    {
      "source_id": "content_checklist",
      "source_type": "human_context",
      "source_ref": "docs/checklists/content-seo-checklist.md",
      "extracted_facts": "The content checklist requires clear purpose, search intent match, source-backed claims, natural keyword coverage, useful headings, internal links, external references where useful, structured data, conversion fit, useful media, and cleanup of generic AI-style writing."
    },
    {
      "source_id": "seo_automation_example",
      "source_type": "human_context",
      "source_ref": "brands/strique/blogs/drafts/seo-automation-agent-loop.md",
      "extracted_facts": "The existing Strique blog draft uses the agent-loop framing: audit, map, prioritize, brief, ship with approval, measure, and learn. It positions Strique around fewer handoffs and more marketing work moving from insight to outcome."
    }
  ],
  "claims": [
    {
      "claim": "The Strique keyword file maps content automation platform and related content automation terms to commercial product intent.",
      "claim_type": "keyword_demand",
      "source_ids": [
        "keywords",
        "keyword_summary"
      ]
    },
    {
      "claim": "Strique is positioned around content, SEO, lifecycle, reporting, generative content, approval gates, closed-loop measurement, reusable skills, persistent memory, and Canvas reports.",
      "claim_type": "brand_context",
      "source_ids": [
        "brand_dna"
      ]
    },
    {
      "claim": "The public Strique inventory includes product, content-engine, SEO automation, brand-context, closing-the-loop, integrations, and customer-story URLs that fit the internal link plan.",
      "claim_type": "site_context",
      "source_ids": [
        "url_inventory"
      ]
    },
    {
      "claim": "The draft should avoid invented stats, fake editorial benchmarks, unsupported platform comparisons, fake customer proof, and unsupported performance promises.",
      "claim_type": "editorial_rule",
      "source_ids": [
        "content_checklist",
        "site_checks"
      ]
    },
    {
      "claim": "The agent-loop framing in this draft is consistent with the existing Strique SEO automation blog pattern.",
      "claim_type": "editorial_context",
      "source_ids": [
        "seo_automation_example"
      ]
    }
  ],
  "detector_notes": []
}
